{
  "output_version": "1.0.0",
  "input_sha256": "a75b5f717b24a4ad91f2c42da12c4c7a702bc8b18632d3f315d177510b2edd9f",
  "rules_version": "1.0.0",
  "dataset_version": "1.2.0",
  "overall_decision": {
    "status": "RECOMMENDED",
    "reason_codes": [],
    "conflicting_fact_ids": [],
    "missing_facts": [],
    "unknown_fact_ids": []
  },
  "selected_records": [
    {
      "record_id": "arch.agent_tool_boundary",
      "status": "RECOMMENDED",
      "rule_id": "R-AGENT-001",
      "predicate_matches": [
        {
          "fact_id": "reads_untrusted_external_content",
          "state": "true"
        },
        {
          "fact_id": "has_read_access",
          "state": "true"
        },
        {
          "fact_id": "has_bounded_write_tool",
          "state": "false"
        },
        {
          "fact_id": "can_cause_side_effects",
          "state": "false"
        },
        {
          "fact_id": "high_impact_action_possible",
          "state": "false"
        },
        {
          "fact_id": "approval_required_for_high_impact",
          "state": "true"
        },
        {
          "fact_id": "approver_available",
          "state": "false"
        },
        {
          "fact_id": "vector_database_requested",
          "state": "false"
        },
        {
          "fact_id": "multi_agent_autonomy_requested",
          "state": "false"
        },
        {
          "fact_id": "production_deployment_requested",
          "state": "false"
        },
        {
          "fact_id": "release_plan_required",
          "state": "false"
        }
      ],
      "scope_conditions": {
        "software_type_id": "software_type.ai_agents",
        "applicable_software_types": [
          "software_type.ai_agents",
          "software_type.developer_tools",
          "software_type.security_products"
        ]
      },
      "category": "architecture_patterns",
      "evidence_paths": [
        {
          "software_type_id": "software_type.ai_agents",
          "applicability_relationship_id": "edge.0012",
          "record_id": "arch.agent_tool_boundary",
          "sources": [
            {
              "source_id": "source.agents.policy",
              "claim_locator": "Private vulnerability reporting; scope; trust boundaries and security review",
              "source_type": "Pinned security policy",
              "source_claims_supported": "Private vulnerability reporting route and stated risk scope, including agent tools/MCP, sessions, tracing, dependencies, CI and publishing.",
              "source_limitations": "A policy does not prove controls are effective or vulnerabilities absent.",
              "relationship_id": "edge.0308",
              "evidence_classification": "observed_implementation"
            },
            {
              "source_id": "source.agents.instructions",
              "claim_locator": "Security checklist; CI permissions; publishing; evidence and handoff",
              "source_type": "Pinned agent/contributor instructions",
              "source_claims_supported": "Repository agent instructions include explicit security checklist and evidence expectations.",
              "source_limitations": "Instructions are written policy, not proof every workflow follows them.",
              "relationship_id": "edge.0309",
              "evidence_classification": "observed_implementation"
            },
            {
              "source_id": "source.owasp.tm.cheatsheet",
              "claim_locator": "Overview; system modeling; threat identification; mitigation; review and validation",
              "source_type": "Security guidance",
              "source_claims_supported": "Models system boundaries, data flows, stores, processes, external entities, threats and mitigations; no one universally accepted process.",
              "source_limitations": "Adaptable guidance; not a compliance standard.",
              "relationship_id": "edge.0310",
              "evidence_classification": "documented_guidance"
            },
            {
              "source_id": "source.openai.prompt_injection",
              "claim_locator": "Source-to-sink risk; Safe Url; sandboxed applications; confirmation for sensitive actions/transmissions",
              "source_type": "Official security engineering article",
              "source_claims_supported": "Describes prompt injection via untrusted content and recommends constraining actions, sandboxing/limits, and user confirmation or blocking for consequential actions and sensitive transmissions.",
              "source_limitations": "First-party security article, not independent benchmark; apply to the actual tool/data threat model.",
              "relationship_id": "edge.0387",
              "evidence_classification": "documented_guidance"
            },
            {
              "source_id": "source.nist.ssdf.v1_1",
              "claim_locator": "Sections 2-3; PO/PS/PW/RV practice headings, especially PW.1, PW.5, PW.7-PW.8 and RV.1-RV.3",
              "source_type": "Federal guidance publication",
              "source_claims_supported": "SSDF is recommended high-level guidance integrable into SDLCs; covers security requirements/risk modeling, code protection, secure coding/review/testing, release integrity and vulnerability response.",
              "source_limitations": "Guidance, not universal mandate unless adopted by policy, contract or regulation. Does not define universal stage gates.",
              "relationship_id": "edge.800004",
              "evidence_classification": "synthesized_mapping"
            }
          ]
        }
      ],
      "option_id": "read_only_allowlisted_tools"
    },
    {
      "record_id": "gate.operational_rollback",
      "status": "INCOMPLETE",
      "rule_id": "R-EVIDENCE-001",
      "predicate_matches": [
        {
          "fact_id": "reads_untrusted_external_content",
          "state": "true"
        },
        {
          "fact_id": "has_read_access",
          "state": "true"
        },
        {
          "fact_id": "has_bounded_write_tool",
          "state": "false"
        },
        {
          "fact_id": "can_cause_side_effects",
          "state": "false"
        },
        {
          "fact_id": "high_impact_action_possible",
          "state": "false"
        },
        {
          "fact_id": "approval_required_for_high_impact",
          "state": "true"
        },
        {
          "fact_id": "approver_available",
          "state": "false"
        },
        {
          "fact_id": "vector_database_requested",
          "state": "false"
        },
        {
          "fact_id": "multi_agent_autonomy_requested",
          "state": "false"
        },
        {
          "fact_id": "production_deployment_requested",
          "state": "false"
        },
        {
          "fact_id": "release_plan_required",
          "state": "false"
        }
      ],
      "scope_conditions": {
        "software_type_id": "software_type.ai_agents",
        "applicable_software_types": [
          "software_type.web_applications",
          "software_type.saas",
          "software_type.apis",
          "software_type.ai_agents",
          "software_type.security_products"
        ]
      },
      "category": "verification_gates",
      "evidence_paths": [
        {
          "software_type_id": "software_type.ai_agents",
          "applicability_relationship_id": "edge.0017",
          "record_id": "gate.operational_rollback",
          "sources": [
            {
              "source_id": "source.scrum.guide.2020",
              "claim_locator": "Product Backlog; Sprint Planning; Increment; Definition of Done; Sprint Review",
              "source_type": "Framework guide",
              "source_claims_supported": "Backlog is ordered/emergent; increments must be usable and meet Definition of Done; planning forecast depends on past performance, capacity and DoD.",
              "source_limitations": "Does not prescribe universal dependency graph, estimation formula, or story acceptance syntax.",
              "relationship_id": "edge.0349",
              "evidence_classification": "documented_guidance"
            },
            {
              "source_id": "source.google.sre.release",
              "claim_locator": "Testing; Packaging; Rapid; Deployment",
              "source_type": "Operational engineering guidance",
              "source_claims_supported": "Describes rerunning tests on the release branch, audit trail, independent system tests of packaged artifacts, and coordinating canaries and rollback.",
              "source_limitations": "Google SRE practice, not a universal policy.",
              "relationship_id": "edge.0396",
              "evidence_classification": "documented_guidance"
            },
            {
              "source_id": "source.google.sre.canary",
              "claim_locator": "Selecting and evaluating metrics; representative and attributable metrics; canary analysis and rollback",
              "source_type": "Operational engineering guidance",
              "source_claims_supported": "Recommends comparing candidate and control using representative attributable service metrics; anomalous candidate outcomes can prompt pausing, rollback or human escalation.",
              "source_limitations": "No universal thresholds; service-specific metric selection required.",
              "relationship_id": "edge.0397",
              "evidence_classification": "documented_guidance"
            }
          ]
        }
      ]
    },
    {
      "record_id": "gate.release_readiness",
      "status": "INCOMPLETE",
      "rule_id": "R-EVIDENCE-001",
      "predicate_matches": [
        {
          "fact_id": "reads_untrusted_external_content",
          "state": "true"
        },
        {
          "fact_id": "has_read_access",
          "state": "true"
        },
        {
          "fact_id": "has_bounded_write_tool",
          "state": "false"
        },
        {